{
  "$schema": "./mcp-schema.json",
  "version": "1.0.0",
  "description": "AI学习平台 MCP / 外挂能力配置。providers=外挂服务（LLM 供应商）连接与状态（仅供管理端展示与健康检查，不参与运行时模型路由；模型路由见管理端「模型与接入」/ platform_api_configs）；tools=平台 MCP 工具，transport=mcp 时该条目代表一个真 MCP server、其工具运行时经 tools/list 发现。",
  "providers": [
    {
      "id": "openai",
      "name": "OpenAI API",
      "type": "openai",
      "endpoint": "${OPENAI_API_URL:-https://api.openai.com/v1}",
      "apiKey": "${OPENAI_API_KEY}",
      "models": [
        "gpt-4",
        "gpt-4-turbo",
        "gpt-3.5-turbo"
      ],
      "defaultModel": "gpt-4",
      "priority": 1,
      "enabled": true,
      "config": {
        "temperature": 0.7,
        "maxTokens": 4000,
        "timeout": 60000
      }
    },
    {
      "id": "newapi",
      "name": "NewAPI 本地服务",
      "type": "openai-compatible",
      "endpoint": "${AI_API_URL:-http://localhost:3000/v1}",
      "apiKey": "${AI_API_KEY}",
      "models": [
        "deepseek-v4.1-flash"
      ],
      "defaultModel": "deepseek-v4.1-flash",
      "priority": 2,
      "enabled": true,
      "config": {
        "temperature": 0.7,
        "maxTokens": 6000,
        "timeout": 120000
      }
    },
    {
      "id": "anthropic",
      "name": "Anthropic Claude",
      "type": "anthropic",
      "endpoint": "${ANTHROPIC_API_URL:-https://api.anthropic.com}",
      "apiKey": "${ANTHROPIC_API_KEY}",
      "models": [
        "claude-3-opus",
        "claude-3-sonnet",
        "claude-3-haiku"
      ],
      "defaultModel": "claude-3-sonnet",
      "priority": 3,
      "enabled": false,
      "config": {
        "temperature": 0.7,
        "maxTokens": 4000,
        "timeout": 60000
      }
    }
  ],
  "tools": [
    {
      "id": "file-reader",
      "name": "文件读取",
      "description": "读取本地文件",
      "type": "filesystem",
      "endpoint": "local",
      "userAccessible": false,
      "config": {
        "allowedPaths": [
          "./uploads",
          "./data"
        ],
        "maxFileSize": 10485760
      },
      "enabled": true
    }
  ],
  "routing": {
    "strategy": "priority",
    "fallback": true,
    "healthCheck": {
      "enabled": true,
      "interval": 300000
    }
  }
}